{"completed_at":"2026-07-31T00:00:00.000000Z","outcome":"no_change","output_manifest_digest":"sha256:96b35d2f930ae0c8c496b0bb8f52a4f8784814c6423671d623dd913910236e8f","protocol":"factory-runner-protocol/v1","protocol_manifest":{"byte_size":49272,"digest":"sha256:96b35d2f930ae0c8c496b0bb8f52a4f8784814c6423671d623dd913910236e8f","media_type":"application/json","path":"protocol-manifest.json"},"run_result":{"byte_size":1367,"digest":"sha256:d501c4a9d59d779c05d15cdbf482626ca35a9b91691881d92d25718216b57945","media_type":"application/json","path":"result/run-result.json"},"schema":"completion/v1","schema_version":1}