{"completed_at":"2026-07-31T00:00:00Z","outcome":"succeeded","output_manifest_digest":"sha256:f8c8b76b3d6d1f59457e20ffcf27649f353d1d688836b9187804c10e5ff02651","protocol":"factory-runner-protocol/v1","protocol_manifest":{"byte_size":959,"digest":"sha256:f8c8b76b3d6d1f59457e20ffcf27649f353d1d688836b9187804c10e5ff02651","media_type":"application/json","path":"protocol-manifest.json"},"run_result":{"byte_size":1473,"digest":"sha256:eab3e372b6ec604ff5290226939ffa34bd5c4ca77847fb62b5ad71a94dace20c","media_type":"application/json","path":"result/run-result.json"},"schema":"completion/v1","schema_version":1}