{"completed_at":"2026-07-31T00:00:00.000000Z","outcome":"succeeded","output_manifest_digest":"sha256:c66acb59ad8ae96e5f0f97d6aaef455b94bb8db20f2e963252fc4c94b9734846","protocol":"factory-runner-protocol/v1","protocol_manifest":{"byte_size":80513,"digest":"sha256:c66acb59ad8ae96e5f0f97d6aaef455b94bb8db20f2e963252fc4c94b9734846","media_type":"application/json","path":"protocol-manifest.json"},"run_result":{"byte_size":1538,"digest":"sha256:59d71e6ec9ad24aec13abf23b890dda0fcbdb49245b09dc2406dc8a7bd80b48f","media_type":"application/json","path":"result/run-result.json"},"schema":"completion/v1","schema_version":1}