{"completed_at":"2026-07-31T00:00:00Z","outcome":"no_change","output_manifest_digest":"sha256:b2bfa75aefd08290b869052d2bdd827225b15b2c5b55d7060e043c1f0a9144cb","protocol":"factory-runner-protocol/v1","protocol_manifest":{"byte_size":437,"digest":"sha256:b2bfa75aefd08290b869052d2bdd827225b15b2c5b55d7060e043c1f0a9144cb","media_type":"application/json","path":"protocol-manifest.json"},"run_result":{"byte_size":1127,"digest":"sha256:87a6a21f728950138bf2d8e49e01361b8266ed96a4e70b313fec31d5744a0699","media_type":"application/json","path":"result/run-result.json"},"schema":"completion/v1","schema_version":1}